[
  {
    "playId": "alls_well_that_ends_well",
    "title": "All's Well That Ends Well",
    "title_short": "All's Well That Ends Well",
    "genre": "Tragicomedy",
    "subgenre": "Problem play",
    "date_written": "1604–1605",
    "act_count": 5,
    "scene_count": 23,
    "setting": "Roussillon, Paris, Florence",
    "themes": ["class", "gender", "marriage", "deception", "forgiveness"],
    "difficulty_rating": 4
  },
  {
    "playId": "antony_and_cleopatra",
    "title": "The Tragedy of Antony and Cleopatra",
    "title_short": "Antony and Cleopatra",
    "genre": "Tragedy",
    "date_written": "1606–1607",
    "date_first_performed": "1607",
    "act_count": 5,
    "scene_count": 42,
    "characters_major": ["Antony", "Cleopatra", "Octavius Caesar", "Enobarbus", "Charmian"],
    "primary_sources": ["Plutarch, Lives (North 1579)"],
    "setting": "Rome, Egypt, and the eastern Mediterranean",
    "themes": ["power", "love", "honor", "political_legitimacy", "performance"],
    "difficulty_rating": 4,
    "content_warning": ["suicide", "war_atrocity"]
  },
  {
    "playId": "as_you_like_it",
    "title": "As You Like It",
    "title_short": "As You Like It",
    "genre": "Comedy",
    "date_written": "1599–1600",
    "act_count": 5,
    "scene_count": 22,
    "characters_major": ["Rosalind", "Orlando", "Celia", "Touchstone", "Jaques", "Duke Senior"],
    "primary_sources": ["Lodge, Rosalynde (1590)"],
    "setting": "The Forest of Arden and the ducal court",
    "themes": ["gender", "identity", "love", "performance", "nature_vs_culture"],
    "difficulty_rating": 3,
    "curriculum_grade_level": [10, 11, 12]
  },
  {
    "playId": "comedy_of_errors",
    "title": "The Comedy of Errors",
    "title_short": "The Comedy of Errors",
    "genre": "Comedy",
    "date_written": "1594",
    "date_first_performed": "28 December 1594 (the Gray's Inn revels — the 'Night of Errors')",
    "date_published": "F1 1623",
    "act_count": 5,
    "scene_count": 11,
    "line_count": 1740,
    "characters_major": ["Antipholus of Syracuse", "Antipholus of Ephesus", "Dromio of Syracuse", "Dromio of Ephesus", "Adriana", "Luciana", "Aegeon", "Duke Solinus", "Angelo", "Abbess (Emilia)", "Courtesan", "Doctor Pinch"],
    "primary_sources": ["Plautus, Menaechmi (the twin brothers)", "Plautus, Amphitruo (the twin servants and the locked-out husband)"],
    "setting": "The city of Ephesus, over a single day",
    "themes": ["identity", "family", "deception", "marriage"],
    "difficulty_rating": 2,
    "curriculum_grade_level": [8, 9, 10],
    "common_in_curriculum": false,
    "synopsis_short": "Two sets of identical twins — masters and servants, separated by a shipwreck in infancy — land in Ephesus on the same day. As the travelling Antipholus and his Dromio are everywhere mistaken for their resident doubles, an afternoon dissolves into beatings, a locked-out husband, a disputed gold chain, an arrest, charges of madness and witchcraft, and a family reunion at the priory.",
    "folger_url": "https://www.folger.edu/explore/shakespeares-works/the-comedy-of-errors/",
    "mit_url": "https://shakespeare.mit.edu/comedy_errors/index.html",
    "wikipedia_url": "https://en.wikipedia.org/wiki/The_Comedy_of_Errors"
  },
  {
    "playId": "coriolanus",
    "title": "The Tragedy of Coriolanus",
    "title_short": "Coriolanus",
    "genre": "Tragedy",
    "subgenre": "Roman tragedy",
    "date_written": "1608",
    "date_first_performed": "c. 1608",
    "date_published": "F1 1623",
    "act_count": 5,
    "scene_count": 29,
    "line_count": 3641,
    "characters_major": ["Coriolanus", "Volumnia", "Menenius", "Aufidius", "Sicinius", "Brutus", "Cominius", "Virgilia", "Titus Lartius", "Valeria", "Young Marcius"],
    "primary_sources": ["Plutarch, Lives (North 1579) — Life of Coriolanus", "Livy, Ab Urbe Condita"],
    "setting": "Republican Rome and the Volscian cities of Corioli and Antium",
    "themes": ["class", "pride", "honor", "masculinity", "political_legitimacy", "war"],
    "difficulty_rating": 5,
    "curriculum_grade_level": [11, 12, 13, 14],
    "common_in_curriculum": false,
    "content_warning": ["violence", "war_atrocity"],
    "synopsis_short": "Caius Marcius, Rome's fiercest soldier, wins the surname Coriolanus by storming the Volscian city of Corioli, but his contempt for the common people and his refusal to court their votes turn the tribunes and the crowd against him. Banished, he joins his old enemy Aufidius and marches on Rome, relenting only when his mother begs him to spare the city — a mercy that costs him his life.",
    "folger_url": "https://www.folger.edu/explore/shakespeares-works/coriolanus/",
    "mit_url": "https://shakespeare.mit.edu/coriolanus/index.html",
    "wikipedia_url": "https://en.wikipedia.org/wiki/Coriolanus_(play)"
  },
  {
    "playId": "cymbeline",
    "title": "The Tragedy of Cymbeline",
    "title_short": "Cymbeline",
    "genre": "Romance",
    "date_written": "1610–1611",
    "date_first_performed": "c. 1611 (seen by Simon Forman)",
    "date_published": "F1 1623",
    "act_count": 5,
    "scene_count": 27,
    "line_count": 3744,
    "characters_major": ["Imogen", "Posthumus", "Iachimo", "Cymbeline", "Cloten", "Queen", "Belarius", "Guiderius", "Arviragus", "Pisanio", "Caius Lucius", "Cornelius", "Jupiter"],
    "primary_sources": ["Holinshed, Chronicles (1587)", "Boccaccio, Decameron 2.9 (the wager)", "Frederyke of Jennen (1560)", "The Rare Triumphs of Love and Fortune (anon., c. 1582)"],
    "setting": "Ancient Britain (the court and the Welsh mountains) and Renaissance Rome",
    "themes": ["jealousy", "fidelity", "forgiveness", "identity", "reunion", "providence", "nationhood", "marriage"],
    "difficulty_rating": 5,
    "curriculum_grade_level": [11, 12],
    "common_in_curriculum": false,
    "content_warning": ["violence", "sexual_coercion"],
    "synopsis_short": "Banished for marrying the king's daughter Imogen, Posthumus is tricked by the Italian Iachimo into believing her unfaithful and orders her killed. Disguised as a boy, Imogen flees toward Wales, where her long-lost royal brothers live in a cave. Through a Roman invasion, a vision of the god Jupiter, and a cascade of revelations, the scattered family and two kingdoms are reconciled.",
    "folger_url": "https://www.folger.edu/explore/shakespeares-works/cymbeline/",
    "mit_url": "https://shakespeare.mit.edu/cymbeline/index.html",
    "wikipedia_url": "https://en.wikipedia.org/wiki/Cymbeline"
  },
  {
    "playId": "hamlet",
    "title": "The Tragedy of Hamlet, Prince of Denmark",
    "title_short": "Hamlet",
    "genre": "Tragedy",
    "subgenre": "Revenge tragedy",
    "date_written": "1600–1601",
    "date_first_performed": "1601 (probable)",
    "date_published": "Q1 1603, Q2 1604, F1 1623",
    "act_count": 5,
    "scene_count": 20,
    "characters_major": ["Hamlet", "Claudius", "Gertrude", "Ophelia", "Polonius", "Horatio", "Laertes", "The Ghost"],
    "primary_sources": ["Saxo Grammaticus, Gesta Danorum (c. 1200)", "Belleforest, Histoires Tragiques (1570)", "Ur-Hamlet (lost, c. 1589)"],
    "setting": "Elsinore, royal court of Denmark",
    "themes": ["revenge", "madness", "mortality", "corruption", "performance", "memory"],
    "difficulty_rating": 4,
    "curriculum_grade_level": [10, 11, 12, 13, 14],
    "common_in_curriculum": true,
    "content_warning": ["violence", "suicide", "mental_health_crisis"],
    "synopsis_short": "A Danish prince, ordered by his murdered father's ghost to avenge the crime, delays and disintegrates while the court around him does the same.",
    "folger_url": "https://www.folger.edu/explore/shakespeares-works/hamlet/",
    "mit_url": "https://shakespeare.mit.edu/hamlet/index.html",
    "wikipedia_url": "https://en.wikipedia.org/wiki/Hamlet"
  },
  {
    "playId": "henry_iv_part_1",
    "title": "The First Part of Henry the Fourth",
    "title_short": "Henry IV, Part 1",
    "genre": "History",
    "date_written": "1596–1597",
    "date_first_performed": "1597 (probable)",
    "date_published": "Q1 1598; F1 1623",
    "act_count": 5,
    "scene_count": 19,
    "line_count": 3180,
    "characters_major": ["Prince Hal", "Falstaff", "Hotspur", "King Henry IV", "Earl of Worcester", "Owen Glendower", "Earl of Douglas", "Mistress Quickly", "Poins", "Lady Percy"],
    "primary_sources": ["Holinshed, Chronicles (1587)", "Daniel, The Civil Wars (1595)", "The Famous Victories of Henry the Fifth (anon., c. 1586)"],
    "setting": "England and Wales, 1402–1403 (ending at the Battle of Shrewsbury)",
    "themes": ["kingship", "honor", "youth_vs_age", "political_legitimacy", "rebellion"],
    "difficulty_rating": 4,
    "curriculum_grade_level": [10, 11, 12],
    "common_in_curriculum": true,
    "content_warning": ["war_atrocity"],
    "synopsis_short": "While rebels rise against Henry IV, the King's tavern-haunting son Prince Hal bides his time among thieves before redeeming himself and killing the rebel hero Hotspur at the Battle of Shrewsbury.",
    "folger_url": "https://www.folger.edu/explore/shakespeares-works/henry-iv-part-1/",
    "mit_url": "https://shakespeare.mit.edu/1henryiv/index.html",
    "wikipedia_url": "https://en.wikipedia.org/wiki/Henry_IV,_Part_1"
  },
  {
    "playId": "henry_iv_part_2",
    "title": "The Second Part of Henry the Fourth",
    "title_short": "Henry IV, Part 2",
    "genre": "History",
    "date_written": "1597–1598",
    "act_count": 5,
    "scene_count": 19,
    "line_count": 3010,
    "characters_major": ["Falstaff", "Prince Hal", "King Henry IV", "Lord Chief Justice", "Justice Shallow", "Prince John of Lancaster", "Earl of Northumberland", "Archbishop of York", "Doll Tearsheet", "Mistress Quickly", "Pistol", "Rumour"],
    "primary_sources": ["Holinshed, Chronicles (1587)", "Samuel Daniel, The First Four Books of the Civil Wars (1595)", "The Famous Victories of Henry V (anonymous, pre-1594)"],